{
  "schema": "gluerun.orchestration.state-packet.v0",
  "packetId": "PKT-TASK-0106-88214",
  "runId": "RUN-20260713T013755Z-88214",
  "taskId": "TASK-0106",
  "area": "graph",
  "role": "l2-developer",
  "status": "accepted",
  "baseRef": "000df5c42c4de35c5fc2a8ff9e4a0595e86f8bfb",
  "branch": "agent/graph/TASK-0106-subgraph-inject",
  "headSha": "1702c13e653e9e178f05dbd78719f64333947b8f",
  "workspace": "/Users/alejandro/Desktop/999. PROJECTS/pmgo-orchestration-engine/.worktrees/TASK-0106",
  "ownedFiles": [
    "engine/ctx-route-subgraph.sh",
    "engine/l1-drive.sh",
    "engine/ctx-rehydrate-event.sh",
    "tests/test-ctx-rehydrate-subgraph-inject.sh"
  ],
  "changedFiles": [
    "engine/ctx-rehydrate-event.sh",
    "engine/ctx-route-subgraph.sh",
    "engine/l1-drive.sh",
    "tests/test-ctx-rehydrate-subgraph-inject.sh"
  ],
  "commands": [
    {
      "cmd": "bash tests/test-ctx-rehydrate-subgraph-inject.sh",
      "exitCode": 1,
      "logRef": ".gluerun-evidence/red.log"
    },
    {
      "cmd": "bash tests/test-ctx-rehydrate-subgraph-inject.sh",
      "exitCode": 0,
      "logRef": ".gluerun-evidence/green.log"
    },
    {
      "cmd": "bash tests/run.sh",
      "exitCode": 0,
      "logRef": ".gluerun-evidence/regression.log"
    }
  ],
  "tests": [
    {
      "name": "test-ctx-rehydrate-subgraph-inject.sh",
      "phase": "red",
      "status": "fail",
      "logRef": ".gluerun-evidence/red.log"
    },
    {
      "name": "test-ctx-rehydrate-subgraph-inject.sh",
      "phase": "green",
      "status": "pass",
      "logRef": ".gluerun-evidence/green.log"
    },
    {
      "name": "tests/run.sh (regression)",
      "phase": "green",
      "status": "pass",
      "logRef": ".gluerun-evidence/regression.log"
    }
  ],
  "evidence": [
    {
      "kind": "red-log",
      "ref": ".gluerun-evidence/red.log"
    },
    {
      "kind": "green-log",
      "ref": ".gluerun-evidence/green.log"
    },
    {
      "kind": "regression-log",
      "ref": ".gluerun-evidence/regression.log"
    },
    {
      "kind": "gate-check",
      "ref": "runs/RUN-20260713T013755Z-88214/gate-check.json"
    },
    {
      "kind": "audit",
      "ref": "runs/RUN-20260713T013755Z-88214/audit.json"
    }
  ],
  "blockers": [],
  "nextAction": "import into control state and reconcile",
  "createdAt": "2026-07-13T01:42:00Z"
}
