{
  "schema": "gluerun.orchestration.state-packet.v0",
  "packetId": "PKT-TASK-0019-plan-revise-decider",
  "runId": "RUN-20260711T071346Z-98750",
  "taskId": "TASK-0019",
  "area": "plancritic",
  "role": "l2-developer",
  "status": "accepted",
  "baseRef": "6f86aa0574313cdd3d73deef86433438b98eb7f2",
  "branch": "agent/plancritic/TASK-0019-plan-revise-decider",
  "headSha": "22e79cd535d14cd52f4f892034752c305274b6ca",
  "workspace": "/Users/alejandro/Desktop/999. PROJECTS/pmgo-orchestration-engine/.worktrees/TASK-0019",
  "ownedFiles": [
    "engine/ctx-plan-revise.sh",
    "tests/test-ctx-plan-revise.sh"
  ],
  "changedFiles": [
    "engine/ctx-plan-revise.sh",
    "tests/test-ctx-plan-revise.sh"
  ],
  "commands": [
    {
      "cmd": "bash tests/test-ctx-plan-revise.sh",
      "exitCode": 1,
      "logRef": ".gluerun-evidence/red.log"
    },
    {
      "cmd": "bash tests/test-ctx-plan-revise.sh",
      "exitCode": 0,
      "logRef": ".gluerun-evidence/green.log"
    },
    {
      "cmd": "bash tests/run.sh",
      "exitCode": 0,
      "logRef": ".gluerun-evidence/regression.log"
    }
  ],
  "tests": [
    {
      "name": "test-ctx-plan-revise.sh",
      "phase": "red",
      "status": "fail",
      "logRef": ".gluerun-evidence/red.log"
    },
    {
      "name": "test-ctx-plan-revise.sh",
      "phase": "green",
      "status": "pass",
      "logRef": ".gluerun-evidence/green.log"
    },
    {
      "name": "tests/run.sh",
      "phase": "green",
      "status": "pass",
      "logRef": ".gluerun-evidence/regression.log"
    }
  ],
  "evidence": [
    {
      "kind": "red-log",
      "ref": ".gluerun-evidence/red.log"
    },
    {
      "kind": "green-log",
      "ref": ".gluerun-evidence/green.log"
    },
    {
      "kind": "regression-log",
      "ref": ".gluerun-evidence/regression.log"
    },
    {
      "kind": "gate-check",
      "ref": "runs/RUN-20260711T071346Z-98750/gate-check.json"
    },
    {
      "kind": "audit",
      "ref": "runs/RUN-20260711T071346Z-98750/audit.json"
    }
  ],
  "blockers": [],
  "nextAction": "import into control state and reconcile",
  "createdAt": "2026-07-11T09:20:00Z"
}
