{
  "schema": "gluerun.orchestration.state-packet.v0",
  "packetId": "PKT-RUN-20260712T011108Z-78804-TASK-0046",
  "runId": "RUN-20260712T011108Z-78804",
  "taskId": "TASK-0046",
  "area": "routing",
  "role": "l2-developer",
  "status": "accepted",
  "baseRef": "d82cc225d2e25e7ebbba61b100a3d4fa5d672673",
  "branch": "agent/routing/TASK-0046-route-lease-taint",
  "headSha": "c6884f670dabb5e22b1070f5f2773b79dd57b09a",
  "workspace": "/Users/alejandro/Desktop/999. PROJECTS/pmgo-orchestration-engine/.worktrees/TASK-0046",
  "ownedFiles": [
    "engine/ctx-route-lease.sh",
    "tests/test-ctx-route-lease.sh",
    "engine/ctx-route-taint.sh",
    "tests/test-ctx-route-taint.sh"
  ],
  "changedFiles": [
    "engine/ctx-route-lease.sh",
    "engine/ctx-route-taint.sh",
    "tests/test-ctx-route-lease.sh",
    "tests/test-ctx-route-taint.sh"
  ],
  "commands": [
    {
      "cmd": "bash tests/test-ctx-route-lease.sh (before impl)",
      "exitCode": 1,
      "logRef": ".gluerun-evidence/red.log"
    },
    {
      "cmd": "bash tests/test-ctx-route-taint.sh (before impl)",
      "exitCode": 1,
      "logRef": ".gluerun-evidence/red.log"
    },
    {
      "cmd": "bash tests/test-ctx-route-lease.sh (after impl)",
      "exitCode": 0,
      "logRef": ".gluerun-evidence/green.log"
    },
    {
      "cmd": "bash tests/test-ctx-route-taint.sh (after impl)",
      "exitCode": 0,
      "logRef": ".gluerun-evidence/green.log"
    },
    {
      "cmd": "bash tests/test-ctx-route-lease.sh && bash tests/test-ctx-route-taint.sh && bash tests/test-engine-clean.sh",
      "exitCode": 0,
      "logRef": ".gluerun-evidence/regression.log"
    }
  ],
  "tests": [
    {
      "name": "test-ctx-route-lease.sh",
      "phase": "red",
      "status": "fail",
      "logRef": ".gluerun-evidence/red.log"
    },
    {
      "name": "test-ctx-route-taint.sh",
      "phase": "red",
      "status": "fail",
      "logRef": ".gluerun-evidence/red.log"
    },
    {
      "name": "test-ctx-route-lease.sh",
      "phase": "green",
      "status": "pass",
      "logRef": ".gluerun-evidence/green.log"
    },
    {
      "name": "test-ctx-route-taint.sh",
      "phase": "green",
      "status": "pass",
      "logRef": ".gluerun-evidence/green.log"
    },
    {
      "name": "test-engine-clean.sh",
      "phase": "green",
      "status": "pass",
      "logRef": ".gluerun-evidence/regression.log"
    }
  ],
  "evidence": [
    {
      "kind": "red-log",
      "ref": ".gluerun-evidence/red.log"
    },
    {
      "kind": "green-log",
      "ref": ".gluerun-evidence/green.log"
    },
    {
      "kind": "regression-log",
      "ref": ".gluerun-evidence/regression.log"
    },
    {
      "kind": "gate-check",
      "ref": "runs/RUN-20260712T011108Z-78804/gate-check.json"
    },
    {
      "kind": "audit",
      "ref": "runs/RUN-20260712T011108Z-78804/audit.json"
    }
  ],
  "blockers": [],
  "nextAction": "import into control state and reconcile",
  "createdAt": "2026-07-12T01:14:04Z"
}
