{
  "schema": "gluerun.orchestration.state-packet.v0",
  "packetId": "PKT-RUN-20260712T154843Z-36590-TASK-0076",
  "runId": "RUN-20260712T154843Z-36590",
  "taskId": "TASK-0076",
  "area": "graph",
  "role": "l2-developer",
  "status": "accepted",
  "baseRef": "44b01e507b42715f36134a4de9ad4301dbdee622",
  "branch": "agent/graph/TASK-0076-graph-projection-mappers",
  "headSha": "0dacf50dd13e8aead84443f3222bb01c95e66e46",
  "workspace": "/Users/alejandro/Desktop/999. PROJECTS/pmgo-orchestration-engine/.worktrees/TASK-0076",
  "ownedFiles": [
    "engine/ctx-graph-project.sh",
    "tests/test-ctx-graph-project.sh"
  ],
  "changedFiles": [
    "engine/ctx-graph-project.sh",
    "tests/test-ctx-graph-project.sh"
  ],
  "commands": [
    {
      "cmd": "bash tests/test-ctx-graph-project.sh",
      "exitCode": 1,
      "logRef": ".gluerun-evidence/red.log"
    },
    {
      "cmd": "bash tests/test-ctx-graph-project.sh",
      "exitCode": 0,
      "logRef": ".gluerun-evidence/green.log"
    },
    {
      "cmd": "bash tests/test-ctx-graph-project.sh && bash tests/test-engine-clean.sh",
      "exitCode": 0,
      "logRef": ".gluerun-evidence/regression.log"
    }
  ],
  "tests": [
    {
      "name": "test-ctx-graph-project.sh",
      "phase": "red",
      "status": "fail",
      "logRef": ".gluerun-evidence/red.log"
    },
    {
      "name": "test-ctx-graph-project.sh",
      "phase": "green",
      "status": "pass",
      "logRef": ".gluerun-evidence/green.log"
    },
    {
      "name": "test-engine-clean.sh",
      "phase": "regression",
      "status": "pass",
      "logRef": ".gluerun-evidence/regression.log"
    }
  ],
  "evidence": [
    {
      "kind": "command-log",
      "ref": ".gluerun-evidence/red.log"
    },
    {
      "kind": "command-log",
      "ref": ".gluerun-evidence/green.log"
    },
    {
      "kind": "command-log",
      "ref": ".gluerun-evidence/regression.log"
    },
    {
      "kind": "gate-check",
      "ref": "runs/RUN-20260712T154843Z-36590/gate-check.json"
    },
    {
      "kind": "audit",
      "ref": "runs/RUN-20260712T154843Z-36590/audit.json"
    }
  ],
  "blockers": [],
  "nextAction": "import into control state and reconcile",
  "createdAt": "2026-07-12T15:48:43Z"
}
