{
  "schema": "gluerun.orchestration.state-packet.v0",
  "packetId": "PKT-TASK-0087-90765",
  "runId": "RUN-20260712T181820Z-90765",
  "taskId": "TASK-0087",
  "area": "eval",
  "role": "l2-developer",
  "status": "accepted",
  "baseRef": "847ef16efc2a26c23af9ba60484882cf00332eec",
  "branch": "agent/eval/TASK-0087-experiment-pipeline-guard",
  "headSha": "05d48bf433dff278bf61f5756de4b05edac3a893",
  "workspace": "/Users/alejandro/Desktop/999. PROJECTS/pmgo-orchestration-engine/.worktrees/TASK-0087",
  "ownedFiles": [
    "engine/ctx-experiment-pipeline.sh",
    "tests/test-ctx-experiment-pipeline.sh"
  ],
  "changedFiles": [
    "engine/ctx-experiment-pipeline.sh",
    "tests/test-ctx-experiment-pipeline.sh"
  ],
  "commands": [
    {
      "cmd": "bash tests/test-ctx-experiment-pipeline.sh",
      "exitCode": 1,
      "logRef": ".gluerun-evidence/red.log"
    },
    {
      "cmd": "bash tests/test-ctx-experiment-pipeline.sh",
      "exitCode": 0,
      "logRef": ".gluerun-evidence/green.log"
    },
    {
      "cmd": "bash tests/test-ctx-experiment-pipeline.sh && bash tests/test-engine-clean.sh",
      "exitCode": 0,
      "logRef": ".gluerun-evidence/regression.log"
    }
  ],
  "tests": [
    {
      "name": "test-ctx-experiment-pipeline.sh",
      "phase": "red",
      "status": "fail",
      "logRef": ".gluerun-evidence/red.log"
    },
    {
      "name": "test-ctx-experiment-pipeline.sh",
      "phase": "green",
      "status": "pass",
      "logRef": ".gluerun-evidence/green.log"
    },
    {
      "name": "test-engine-clean.sh",
      "phase": "green",
      "status": "pass",
      "logRef": ".gluerun-evidence/regression.log"
    }
  ],
  "evidence": [
    {
      "kind": "red-log",
      "ref": ".gluerun-evidence/red.log"
    },
    {
      "kind": "green-log",
      "ref": ".gluerun-evidence/green.log"
    },
    {
      "kind": "regression-log",
      "ref": ".gluerun-evidence/regression.log"
    },
    {
      "kind": "gate-check",
      "ref": "runs/RUN-20260712T181820Z-90765/gate-check.json"
    },
    {
      "kind": "audit",
      "ref": "runs/RUN-20260712T181820Z-90765/audit.json"
    }
  ],
  "blockers": [],
  "nextAction": "import into control state and reconcile",
  "createdAt": "2026-07-12T18:22:00Z"
}
