{
  "schema": "gluerun.orchestration.state-packet.v0",
  "packetId": "PKT-TASK-0066-20260712T090649Z",
  "runId": "RUN-20260712T090425Z-35425",
  "taskId": "TASK-0066",
  "area": "routing",
  "role": "l2-developer",
  "status": "accepted",
  "baseRef": "460467d22af820d749171c86d806e606afe8ea29",
  "branch": "agent/routing/TASK-0066-rehydrate-authored-node",
  "headSha": "93cbd85ada41db2f6cabfdcb863157b37e150a09",
  "workspace": "/Users/alejandro/Desktop/999. PROJECTS/pmgo-orchestration-engine/.worktrees/TASK-0066",
  "ownedFiles": [
    "engine/ctx-rehydrate-authored-node.sh",
    "tests/test-ctx-rehydrate-authored-node.sh"
  ],
  "changedFiles": [
    "engine/ctx-rehydrate-authored-node.sh",
    "tests/test-ctx-rehydrate-authored-node.sh"
  ],
  "commands": [
    {
      "cmd": "bash tests/test-ctx-rehydrate-authored-node.sh",
      "exitCode": 1,
      "logRef": ".gluerun-evidence/red.log"
    },
    {
      "cmd": "bash tests/test-ctx-rehydrate-authored-node.sh",
      "exitCode": 0,
      "logRef": ".gluerun-evidence/green.log"
    },
    {
      "cmd": "bash tests/test-ctx-rehydrate-authored-node.sh && bash tests/test-engine-clean.sh",
      "exitCode": 0,
      "logRef": ".gluerun-evidence/regression.log"
    }
  ],
  "tests": [
    {
      "name": "test-ctx-rehydrate-authored-node.sh",
      "phase": "red",
      "status": "fail",
      "logRef": ".gluerun-evidence/red.log"
    },
    {
      "name": "test-ctx-rehydrate-authored-node.sh",
      "phase": "green",
      "status": "pass",
      "logRef": ".gluerun-evidence/green.log"
    },
    {
      "name": "test-engine-clean.sh",
      "phase": "regression",
      "status": "pass",
      "logRef": ".gluerun-evidence/regression.log"
    }
  ],
  "evidence": [
    {
      "kind": "red-log",
      "ref": ".gluerun-evidence/red.log"
    },
    {
      "kind": "green-log",
      "ref": ".gluerun-evidence/green.log"
    },
    {
      "kind": "regression-log",
      "ref": ".gluerun-evidence/regression.log"
    },
    {
      "kind": "gate-check",
      "ref": "runs/RUN-20260712T090425Z-35425/gate-check.json"
    },
    {
      "kind": "audit",
      "ref": "runs/RUN-20260712T090425Z-35425/audit.json"
    }
  ],
  "blockers": [],
  "nextAction": "import into control state and reconcile",
  "createdAt": "2026-07-12T09:06:49Z"
}
