{
  "schema": "gluerun.orchestration.state-packet.v0",
  "packetId": "PKT-TASK-0007-RUN-20260711T013743Z-44010",
  "runId": "RUN-20260711T013743Z-44010",
  "taskId": "TASK-0007",
  "area": "session",
  "role": "l2-developer",
  "status": "accepted",
  "baseRef": "1d593959e95783c627cd00888a05558368458d58",
  "branch": "agent/session/TASK-0007-planner-session-meta",
  "headSha": "2d24f1afaf899deea0eee8ee42b67bd031dc6d9b",
  "workspace": "/Users/alejandro/Desktop/999. PROJECTS/pmgo-orchestration-engine/.worktrees/TASK-0007",
  "ownedFiles": [
    "engine/ctx-planner-session.sh",
    "tests/test-ctx-planner-session.sh"
  ],
  "changedFiles": [
    "engine/ctx-planner-session.sh",
    "tests/test-ctx-planner-session.sh"
  ],
  "commands": [
    {
      "cmd": "bash tests/test-ctx-planner-session.sh",
      "exitCode": 1,
      "logRef": ".gluerun-evidence/red.log"
    },
    {
      "cmd": "bash tests/test-ctx-planner-session.sh",
      "exitCode": 0,
      "logRef": ".gluerun-evidence/green.log"
    },
    {
      "cmd": "bash tests/run.sh",
      "exitCode": 0,
      "logRef": ".gluerun-evidence/regression.log"
    }
  ],
  "tests": [
    {
      "name": "test-ctx-planner-session.sh",
      "phase": "red",
      "status": "fail",
      "logRef": ".gluerun-evidence/red.log"
    },
    {
      "name": "test-ctx-planner-session.sh",
      "phase": "green",
      "status": "pass",
      "logRef": ".gluerun-evidence/green.log"
    },
    {
      "name": "tests/run.sh (regression)",
      "phase": "green",
      "status": "pass",
      "logRef": ".gluerun-evidence/regression.log"
    }
  ],
  "evidence": [
    {
      "kind": "red-log",
      "ref": ".gluerun-evidence/red.log"
    },
    {
      "kind": "green-log",
      "ref": ".gluerun-evidence/green.log"
    },
    {
      "kind": "regression-log",
      "ref": ".gluerun-evidence/regression.log"
    },
    {
      "kind": "gate-check",
      "ref": "runs/RUN-20260711T013743Z-44010/gate-check.json"
    },
    {
      "kind": "audit",
      "ref": "runs/RUN-20260711T013743Z-44010/audit.json"
    }
  ],
  "blockers": [],
  "nextAction": "import into control state and reconcile",
  "createdAt": "2026-07-11T01:43:00Z"
}
