{
  "schema": "gluerun.orchestration.state-packet.v0",
  "packetId": "RUN-20260712T203946Z-72368-packet",
  "runId": "RUN-20260712T203946Z-72368",
  "taskId": "TASK-0095",
  "area": "eval",
  "role": "l2-developer",
  "status": "accepted",
  "baseRef": "f58b7e7193edaa2ac90175d36f173965a8e992db",
  "branch": "agent/eval/TASK-0095-armstate-drive-hook",
  "headSha": "4324ad1178fe1d6603b2c1a38207cbee9af6f181",
  "workspace": "/Users/alejandro/Desktop/999. PROJECTS/pmgo-orchestration-engine/.worktrees/TASK-0095",
  "ownedFiles": [
    "engine/l1-drive.sh",
    "tests/test-l1-drive-armstate.sh"
  ],
  "changedFiles": [
    "engine/l1-drive.sh",
    "tests/test-l1-drive-armstate.sh"
  ],
  "commands": [
    {
      "cmd": "bash tests/test-l1-drive-armstate.sh",
      "exitCode": 1,
      "logRef": ".gluerun-evidence/red.log"
    },
    {
      "cmd": "bash tests/test-l1-drive-armstate.sh",
      "exitCode": 0,
      "logRef": ".gluerun-evidence/green.log"
    },
    {
      "cmd": "bash tests/run.sh",
      "exitCode": 0,
      "logRef": ".gluerun-evidence/regression.log"
    }
  ],
  "tests": [
    {
      "name": "test-l1-drive-armstate.sh",
      "phase": "red",
      "status": "fail",
      "logRef": ".gluerun-evidence/red.log"
    },
    {
      "name": "test-l1-drive-armstate.sh",
      "phase": "green",
      "status": "pass",
      "logRef": ".gluerun-evidence/green.log"
    },
    {
      "name": "tests/run.sh (full regression, 115 passed / 0 failed; incl. test-engine-clean.sh)",
      "phase": "green",
      "status": "pass",
      "logRef": ".gluerun-evidence/regression.log"
    }
  ],
  "evidence": [
    {
      "kind": "red-log",
      "ref": ".gluerun-evidence/red.log"
    },
    {
      "kind": "green-log",
      "ref": ".gluerun-evidence/green.log"
    },
    {
      "kind": "regression-log",
      "ref": ".gluerun-evidence/regression.log"
    },
    {
      "kind": "gate-check",
      "ref": "runs/RUN-20260712T203946Z-72368/gate-check.json"
    },
    {
      "kind": "audit",
      "ref": "runs/RUN-20260712T203946Z-72368/audit.json"
    }
  ],
  "blockers": [],
  "nextAction": "import into control state and reconcile",
  "createdAt": "2026-07-12T20:39:46Z"
}
