{
  "schema": "gluerun.orchestration.state-packet.v0",
  "packetId": "PKT-TASK-0103-20260712T234435Z",
  "runId": "RUN-20260712T234435Z-35600",
  "taskId": "TASK-0103",
  "area": "eval",
  "role": "l2-developer",
  "status": "accepted",
  "baseRef": "bf5e16313dfb6fae1b42745d78c736ac3823fed8",
  "branch": "agent/eval/TASK-0103-experiment-run-operator-handoff",
  "headSha": "a81ef1f23c75e81fbb0856dc460e3f586b94b7fc",
  "workspace": "/Users/alejandro/Desktop/999. PROJECTS/pmgo-orchestration-engine/.worktrees/TASK-0103",
  "ownedFiles": [
    "Any file outside the owned scope.",
    "docs/orchestration/handoffs/experiment-run.operator-handoff.md"
  ],
  "changedFiles": [
    "docs/orchestration/handoffs/experiment-run.operator-handoff.md"
  ],
  "commands": [
    {
      "cmd": "bash tests/run.sh",
      "exitCode": 0,
      "logRef": ".gluerun-evidence/regression.log"
    }
  ],
  "tests": [
    {
      "name": "TASK-0103 red phase \u2014 operator-handoff record absent / gate unpublished pre-change",
      "phase": "red",
      "status": "pass",
      "logRef": ".gluerun-evidence/red.log"
    },
    {
      "name": "TASK-0103 green phase \u2014 hand-off record authored, no completion declared, gate not fabricated",
      "phase": "green",
      "status": "pass",
      "logRef": ".gluerun-evidence/green.log"
    },
    {
      "name": "tests/run.sh full regression (121 passed, 0 failed)",
      "phase": "regression",
      "status": "pass",
      "logRef": ".gluerun-evidence/regression.log"
    }
  ],
  "evidence": [
    {
      "kind": "analysis",
      "ref": ".gluerun-evidence/analysis.log"
    },
    {
      "kind": "red-log",
      "ref": ".gluerun-evidence/red.log"
    },
    {
      "kind": "green-log",
      "ref": ".gluerun-evidence/green.log"
    },
    {
      "kind": "regression-log",
      "ref": ".gluerun-evidence/regression.log"
    },
    {
      "kind": "artifact",
      "ref": "docs/orchestration/handoffs/experiment-run.operator-handoff.md"
    },
    {
      "kind": "gate-check",
      "ref": "runs/RUN-20260712T234435Z-35600/gate-check.json"
    },
    {
      "kind": "audit",
      "ref": "runs/RUN-20260712T234435Z-35600/audit.json"
    }
  ],
  "blockers": [],
  "nextAction": "import into control state and reconcile",
  "createdAt": "2026-07-12T23:44:35Z"
}
