{
  "schema": "gluerun.orchestration.state-packet.v0",
  "packetId": "PKT-TASK-0081-20260712T165929Z",
  "runId": "RUN-20260712T165929Z-17142",
  "taskId": "TASK-0081",
  "area": "eval",
  "role": "l2-developer",
  "status": "accepted",
  "baseRef": "1752f2d73bf9dd6b214ccfaf2f5b4b821bc5366c",
  "branch": "agent/eval/TASK-0081-experiment-attempts-metrics",
  "headSha": "3000449462c4bffdb1ac9adb6630711124cb0ab0",
  "workspace": "/Users/alejandro/Desktop/999. PROJECTS/pmgo-orchestration-engine/.worktrees/TASK-0081",
  "ownedFiles": [
    "engine/ctx-experiment-attempts.sh",
    "schemas/orchestration/ctx-experiment-attempts.v0.schema.json",
    "tests/test-ctx-experiment-attempts.sh"
  ],
  "changedFiles": [
    "engine/ctx-experiment-attempts.sh",
    "schemas/orchestration/ctx-experiment-attempts.v0.schema.json",
    "tests/test-ctx-experiment-attempts.sh"
  ],
  "commands": [
    {
      "cmd": "bash tests/test-ctx-experiment-attempts.sh",
      "exitCode": 1,
      "logRef": ".gluerun-evidence/red.log"
    },
    {
      "cmd": "bash tests/test-ctx-experiment-attempts.sh",
      "exitCode": 0,
      "logRef": ".gluerun-evidence/green.log"
    },
    {
      "cmd": "bash tests/test-ctx-experiment-attempts.sh && bash tests/test-engine-clean.sh",
      "exitCode": 0,
      "logRef": ".gluerun-evidence/regression.log"
    }
  ],
  "tests": [
    {
      "name": "test-ctx-experiment-attempts.sh",
      "phase": "red",
      "status": "fail",
      "logRef": ".gluerun-evidence/red.log"
    },
    {
      "name": "test-ctx-experiment-attempts.sh",
      "phase": "green",
      "status": "pass",
      "logRef": ".gluerun-evidence/green.log"
    },
    {
      "name": "test-engine-clean.sh",
      "phase": "green",
      "status": "pass",
      "logRef": ".gluerun-evidence/regression.log"
    }
  ],
  "evidence": [
    {
      "kind": "red-log",
      "ref": ".gluerun-evidence/red.log"
    },
    {
      "kind": "green-log",
      "ref": ".gluerun-evidence/green.log"
    },
    {
      "kind": "regression-log",
      "ref": ".gluerun-evidence/regression.log"
    },
    {
      "kind": "gate-check",
      "ref": "runs/RUN-20260712T165929Z-17142/gate-check.json"
    },
    {
      "kind": "audit",
      "ref": "runs/RUN-20260712T165929Z-17142/audit.json"
    }
  ],
  "blockers": [],
  "nextAction": "import into control state and reconcile",
  "createdAt": "2026-07-12T16:59:29Z"
}
