{
  "schema": "gluerun.orchestration.state-packet.v0",
  "packetId": "PKT-RUN-20260711T193107Z-45555-TASK-0039",
  "runId": "RUN-20260711T193107Z-45555",
  "taskId": "TASK-0039",
  "area": "packets",
  "role": "l2-developer",
  "status": "accepted",
  "baseRef": "1a0dff058e722e82f8581a5cd807a4f1e90de721",
  "branch": "agent/packets/TASK-0039-assumption-ledger-assemble",
  "headSha": "b03b688a2e67d3fab70382a98ab252ac3f6dca7f",
  "workspace": "/Users/alejandro/Desktop/999. PROJECTS/pmgo-orchestration-engine/.worktrees/TASK-0039",
  "ownedFiles": [
    "engine/ctx-assumptions-assemble.sh",
    "tests/test-ctx-assumptions-assemble.sh"
  ],
  "changedFiles": [
    "engine/ctx-assumptions-assemble.sh",
    "tests/test-ctx-assumptions-assemble.sh"
  ],
  "commands": [
    {
      "cmd": "bash tests/test-ctx-assumptions-assemble.sh",
      "exitCode": 1,
      "logRef": ".gluerun-evidence/red.log"
    },
    {
      "cmd": "bash tests/test-ctx-assumptions-assemble.sh",
      "exitCode": 0,
      "logRef": ".gluerun-evidence/green.log"
    },
    {
      "cmd": "bash tests/test-ctx-assumptions-assemble.sh && bash tests/test-engine-clean.sh",
      "exitCode": 0,
      "logRef": ".gluerun-evidence/regression.log"
    }
  ],
  "tests": [
    {
      "name": "test-ctx-assumptions-assemble.sh",
      "phase": "red",
      "status": "fail",
      "logRef": ".gluerun-evidence/red.log"
    },
    {
      "name": "test-ctx-assumptions-assemble.sh",
      "phase": "green",
      "status": "pass",
      "logRef": ".gluerun-evidence/green.log"
    },
    {
      "name": "test-engine-clean.sh",
      "phase": "green",
      "status": "pass",
      "logRef": ".gluerun-evidence/regression.log"
    }
  ],
  "evidence": [
    {
      "kind": "red-log",
      "ref": ".gluerun-evidence/red.log"
    },
    {
      "kind": "green-log",
      "ref": ".gluerun-evidence/green.log"
    },
    {
      "kind": "regression-log",
      "ref": ".gluerun-evidence/regression.log"
    },
    {
      "kind": "gate-check",
      "ref": "runs/RUN-20260711T193107Z-45555/gate-check.json"
    },
    {
      "kind": "audit",
      "ref": "runs/RUN-20260711T193107Z-45555/audit.json"
    }
  ],
  "blockers": [],
  "nextAction": "import into control state and reconcile",
  "createdAt": "2026-07-11T19:33:49Z"
}
