{
  "schema": "gluerun.orchestration.state-packet.v0",
  "packetId": "PKT-TASK-0020-plan-revise-prompt",
  "runId": "RUN-20260711T073419Z-31883",
  "taskId": "TASK-0020",
  "area": "plancritic",
  "role": "l2-developer",
  "status": "accepted",
  "baseRef": "132f7db5c88f78b0c78ae9ad837e681705deb366",
  "branch": "agent/plancritic/TASK-0020-plan-revise-prompt",
  "headSha": "1e4c18cd080b86fa91b49a15b890216549506524",
  "workspace": "/Users/alejandro/Desktop/999. PROJECTS/pmgo-orchestration-engine/.worktrees/TASK-0020",
  "ownedFiles": [
    "engine/ctx-plan-revise-prompt.sh",
    "tests/test-ctx-plan-revise-prompt.sh"
  ],
  "changedFiles": [
    "engine/ctx-plan-revise-prompt.sh",
    "tests/test-ctx-plan-revise-prompt.sh"
  ],
  "commands": [
    {
      "cmd": "bash tests/test-ctx-plan-revise-prompt.sh",
      "exitCode": 1,
      "logRef": ".gluerun-evidence/red.log"
    },
    {
      "cmd": "bash tests/test-ctx-plan-revise-prompt.sh",
      "exitCode": 0,
      "logRef": ".gluerun-evidence/green.log"
    },
    {
      "cmd": "bash tests/run.sh",
      "exitCode": 0,
      "logRef": ".gluerun-evidence/regression.log"
    }
  ],
  "tests": [
    {
      "name": "test-ctx-plan-revise-prompt.sh",
      "phase": "red",
      "status": "fail",
      "logRef": ".gluerun-evidence/red.log"
    },
    {
      "name": "test-ctx-plan-revise-prompt.sh",
      "phase": "green",
      "status": "pass",
      "logRef": ".gluerun-evidence/green.log"
    },
    {
      "name": "tests/run.sh",
      "phase": "regression",
      "status": "pass",
      "logRef": ".gluerun-evidence/regression.log"
    }
  ],
  "evidence": [
    {
      "kind": "red-log",
      "ref": ".gluerun-evidence/red.log"
    },
    {
      "kind": "green-log",
      "ref": ".gluerun-evidence/green.log"
    },
    {
      "kind": "regression-log",
      "ref": ".gluerun-evidence/regression.log"
    },
    {
      "kind": "gate-check",
      "ref": "runs/RUN-20260711T073419Z-31883/gate-check.json"
    },
    {
      "kind": "audit",
      "ref": "runs/RUN-20260711T073419Z-31883/audit.json"
    }
  ],
  "blockers": [],
  "nextAction": "import into control state and reconcile",
  "createdAt": "2026-07-11T07:34:19Z"
}
