{
  "schema": "gluerun.orchestration.state-packet.v0",
  "packetId": "PKT-TASK-0047-route-spine",
  "runId": "RUN-20260712T012625Z-55535",
  "taskId": "TASK-0047",
  "area": "routing",
  "role": "l2-developer",
  "status": "accepted",
  "baseRef": "b9dbe01f4b85451a32cfe1aa4e7aa9bd39c6b638",
  "branch": "agent/routing/TASK-0047-route-spine",
  "headSha": "db0abd1ab3c37df79bb78cd36c695e4f51267d76",
  "workspace": "/Users/alejandro/Desktop/999. PROJECTS/pmgo-orchestration-engine/.worktrees/TASK-0047",
  "ownedFiles": [
    "engine/ctx-route.sh",
    "tests/test-ctx-route.sh"
  ],
  "changedFiles": [
    "engine/ctx-route.sh",
    "tests/test-ctx-route.sh"
  ],
  "commands": [
    {
      "cmd": "bash tests/test-ctx-route.sh",
      "exitCode": 1,
      "logRef": ".gluerun-evidence/red.log"
    },
    {
      "cmd": "bash tests/test-ctx-route.sh",
      "exitCode": 0,
      "logRef": ".gluerun-evidence/green.log"
    },
    {
      "cmd": "bash tests/test-ctx-route.sh && bash tests/test-engine-clean.sh",
      "exitCode": 0,
      "logRef": ".gluerun-evidence/regression.log"
    }
  ],
  "tests": [
    {
      "name": "test-ctx-route.sh",
      "phase": "red",
      "status": "fail",
      "logRef": ".gluerun-evidence/red.log"
    },
    {
      "name": "test-ctx-route.sh",
      "phase": "green",
      "status": "pass",
      "logRef": ".gluerun-evidence/green.log"
    },
    {
      "name": "test-engine-clean.sh",
      "phase": "green",
      "status": "pass",
      "logRef": ".gluerun-evidence/regression.log"
    }
  ],
  "evidence": [
    {
      "kind": "red-log",
      "ref": ".gluerun-evidence/red.log"
    },
    {
      "kind": "green-log",
      "ref": ".gluerun-evidence/green.log"
    },
    {
      "kind": "regression-log",
      "ref": ".gluerun-evidence/regression.log"
    },
    {
      "kind": "gate-check",
      "ref": "runs/RUN-20260712T012625Z-55535/gate-check.json"
    },
    {
      "kind": "audit",
      "ref": "runs/RUN-20260712T012625Z-55535/audit.json"
    }
  ],
  "blockers": [],
  "nextAction": "import into control state and reconcile",
  "createdAt": "2026-07-12T01:26:25Z"
}
