{
  "schema": "gluerun.orchestration.state-packet.v0",
  "packetId": "PKT-TASK-0078-RUN-20260712T163252Z-42242",
  "runId": "RUN-20260712T163252Z-42242",
  "taskId": "TASK-0078",
  "area": "graph",
  "role": "l2-developer",
  "status": "accepted",
  "baseRef": "9b23df762d5c6aa804445b85c44719de9397cde1",
  "branch": "agent/graph/TASK-0078-graph-project-plans",
  "headSha": "a5ac84a1ad0fc014a7b7c3f97d9421067a92b59e",
  "workspace": "/Users/alejandro/Desktop/999. PROJECTS/pmgo-orchestration-engine/.worktrees/TASK-0078",
  "ownedFiles": [
    "engine/ctx-graph-project-plans.sh",
    "tests/test-ctx-graph-project-plans.sh"
  ],
  "changedFiles": [
    "engine/ctx-graph-project-plans.sh",
    "tests/test-ctx-graph-project-plans.sh"
  ],
  "commands": [
    {
      "cmd": "bash tests/test-ctx-graph-project-plans.sh",
      "exitCode": 1,
      "logRef": ".gluerun-evidence/red.log"
    },
    {
      "cmd": "bash tests/test-ctx-graph-project-plans.sh",
      "exitCode": 0,
      "logRef": ".gluerun-evidence/green.log"
    },
    {
      "cmd": "bash tests/test-ctx-graph-project-plans.sh && bash tests/test-engine-clean.sh",
      "exitCode": 0,
      "logRef": ".gluerun-evidence/regression.log"
    }
  ],
  "tests": [
    {
      "name": "test-ctx-graph-project-plans.sh",
      "phase": "red",
      "status": "fail",
      "logRef": ".gluerun-evidence/red.log"
    },
    {
      "name": "test-ctx-graph-project-plans.sh",
      "phase": "green",
      "status": "pass",
      "logRef": ".gluerun-evidence/green.log"
    },
    {
      "name": "test-engine-clean.sh",
      "phase": "green",
      "status": "pass",
      "logRef": ".gluerun-evidence/regression.log"
    }
  ],
  "evidence": [
    {
      "kind": "red-log",
      "ref": ".gluerun-evidence/red.log"
    },
    {
      "kind": "green-log",
      "ref": ".gluerun-evidence/green.log"
    },
    {
      "kind": "regression-log",
      "ref": ".gluerun-evidence/regression.log"
    },
    {
      "kind": "gate-check",
      "ref": "runs/RUN-20260712T163252Z-42242/gate-check.json"
    },
    {
      "kind": "audit",
      "ref": "runs/RUN-20260712T163252Z-42242/audit.json"
    }
  ],
  "blockers": [],
  "nextAction": "import into control state and reconcile",
  "createdAt": "2026-07-12T16:32:52Z"
}
