{
  "schema": "gluerun.orchestration.state-packet.v0",
  "packetId": "PKT-TASK-0055-20260712T043128Z",
  "runId": "RUN-20260712T043128Z-84138",
  "taskId": "TASK-0055",
  "area": "routing",
  "role": "l2-developer",
  "status": "accepted",
  "baseRef": "2f3135f06ce0d25c800d7c97c3ae6ff1dd4a298b",
  "branch": "agent/routing/TASK-0055-rehydrate-event-payload",
  "headSha": "a1d8af20f5407ff4c813e4300927b7ae8340acc6",
  "workspace": "/Users/alejandro/Desktop/999. PROJECTS/pmgo-orchestration-engine/.worktrees/TASK-0055",
  "ownedFiles": [
    "engine/ctx-rehydrate-event.sh",
    "tests/test-ctx-rehydrate-event.sh"
  ],
  "changedFiles": [
    "engine/ctx-rehydrate-event.sh",
    "tests/test-ctx-rehydrate-event.sh"
  ],
  "commands": [
    {
      "cmd": "bash tests/test-ctx-rehydrate-event.sh",
      "exitCode": 1,
      "logRef": ".gluerun-evidence/red.log"
    },
    {
      "cmd": "bash tests/test-ctx-rehydrate-event.sh",
      "exitCode": 0,
      "logRef": ".gluerun-evidence/green.log"
    },
    {
      "cmd": "bash tests/test-ctx-rehydrate-event.sh && bash tests/test-engine-clean.sh",
      "exitCode": 0,
      "logRef": ".gluerun-evidence/regression.log"
    }
  ],
  "tests": [
    {
      "name": "test-ctx-rehydrate-event.sh",
      "phase": "red",
      "status": "fail",
      "logRef": ".gluerun-evidence/red.log"
    },
    {
      "name": "test-ctx-rehydrate-event.sh",
      "phase": "green",
      "status": "pass",
      "logRef": ".gluerun-evidence/green.log"
    },
    {
      "name": "test-engine-clean.sh",
      "phase": "regression",
      "status": "pass",
      "logRef": ".gluerun-evidence/regression.log"
    }
  ],
  "evidence": [
    {
      "kind": "red-log",
      "ref": ".gluerun-evidence/red.log"
    },
    {
      "kind": "green-log",
      "ref": ".gluerun-evidence/green.log"
    },
    {
      "kind": "regression-log",
      "ref": ".gluerun-evidence/regression.log"
    },
    {
      "kind": "gate-check",
      "ref": "runs/RUN-20260712T043128Z-84138/gate-check.json"
    },
    {
      "kind": "audit",
      "ref": "runs/RUN-20260712T043128Z-84138/audit.json"
    }
  ],
  "blockers": [],
  "nextAction": "import into control state and reconcile",
  "createdAt": "2026-07-12T04:31:28Z"
}
