{
  "schema": "gluerun.orchestration.state-packet.v0",
  "packetId": "PKT-TASK-0001-ctx-loader-95503",
  "runId": "RUN-20260710T224233Z-95503",
  "taskId": "TASK-0001",
  "area": "foundation",
  "role": "l2-developer",
  "status": "accepted",
  "baseRef": "df4d35da4c6bf8dceaa94a274fa9149f21a42e53",
  "branch": "agent/foundation/TASK-0001-ctx-loader",
  "headSha": "efae80eb1daed91b699e79567f1b000975f8e318",
  "workspace": "/Users/alejandro/Desktop/999. PROJECTS/pmgo-orchestration-engine/.worktrees/TASK-0001",
  "ownedFiles": [
    "engine/lib.sh",
    "tests/test-ctx-loader.sh"
  ],
  "changedFiles": [
    "engine/lib.sh",
    "tests/test-ctx-loader.sh"
  ],
  "commands": [
    {
      "cmd": "bash tests/test-ctx-loader.sh",
      "exitCode": 1,
      "logRef": ".gluerun-evidence/red.log"
    },
    {
      "cmd": "bash tests/test-ctx-loader.sh",
      "exitCode": 0,
      "logRef": ".gluerun-evidence/green.log"
    },
    {
      "cmd": "bash tests/run.sh",
      "exitCode": 0,
      "logRef": ".gluerun-evidence/regression.log"
    }
  ],
  "tests": [
    {
      "name": "test-ctx-loader.sh",
      "phase": "red",
      "status": "fail",
      "logRef": ".gluerun-evidence/red.log"
    },
    {
      "name": "test-ctx-loader.sh",
      "phase": "green",
      "status": "pass",
      "logRef": ".gluerun-evidence/green.log"
    },
    {
      "name": "tests/run.sh (regression, 24 files)",
      "phase": "green",
      "status": "pass",
      "logRef": ".gluerun-evidence/regression.log"
    }
  ],
  "evidence": [
    {
      "kind": "red-log",
      "ref": ".gluerun-evidence/red.log"
    },
    {
      "kind": "green-log",
      "ref": ".gluerun-evidence/green.log"
    },
    {
      "kind": "regression-log",
      "ref": ".gluerun-evidence/regression.log"
    },
    {
      "kind": "gate-check",
      "ref": "runs/RUN-20260710T224233Z-95503/gate-check.json"
    },
    {
      "kind": "audit",
      "ref": "runs/RUN-20260710T224233Z-95503/audit.json"
    }
  ],
  "blockers": [],
  "nextAction": "import into control state and reconcile",
  "createdAt": "2026-07-11T00:00:00Z"
}
