{
  "schema": "gluerun.orchestration.state-packet.v0",
  "packetId": "PKT-TASK-0093-20260712T201113Z",
  "runId": "RUN-20260712T201113Z-58914",
  "taskId": "TASK-0093",
  "area": "eval",
  "role": "l2-developer",
  "status": "accepted",
  "baseRef": "dbdb69748060b512c864b132e88ee1ca93b2a11d",
  "branch": "agent/eval/TASK-0093-experiment-armstate",
  "headSha": "128c92c290a28331f0aeef8104b52e206d1785aa",
  "workspace": "/Users/alejandro/Desktop/999. PROJECTS/pmgo-orchestration-engine/.worktrees/TASK-0093",
  "ownedFiles": [
    "engine/ctx-experiment-armstate.sh",
    "schemas/orchestration/ctx-experiment-armstate.v0.schema.json",
    "tests/test-ctx-experiment-armstate.sh"
  ],
  "changedFiles": [
    "engine/ctx-experiment-armstate.sh",
    "schemas/orchestration/ctx-experiment-armstate.v0.schema.json",
    "tests/test-ctx-experiment-armstate.sh"
  ],
  "commands": [
    {
      "cmd": "bash tests/test-ctx-experiment-armstate.sh",
      "exitCode": 1,
      "logRef": ".gluerun-evidence/red.log"
    },
    {
      "cmd": "bash tests/test-ctx-experiment-armstate.sh",
      "exitCode": 0,
      "logRef": ".gluerun-evidence/green.log"
    },
    {
      "cmd": "bash tests/test-ctx-experiment-armstate.sh && bash tests/test-engine-clean.sh",
      "exitCode": 0,
      "logRef": ".gluerun-evidence/regression.log"
    }
  ],
  "tests": [
    {
      "name": "test-ctx-experiment-armstate.sh",
      "phase": "red",
      "status": "fail",
      "logRef": ".gluerun-evidence/red.log"
    },
    {
      "name": "test-ctx-experiment-armstate.sh",
      "phase": "green",
      "status": "pass",
      "logRef": ".gluerun-evidence/green.log"
    },
    {
      "name": "test-engine-clean.sh",
      "phase": "green",
      "status": "pass",
      "logRef": ".gluerun-evidence/regression.log"
    }
  ],
  "evidence": [
    {
      "kind": "red-log",
      "ref": ".gluerun-evidence/red.log"
    },
    {
      "kind": "green-log",
      "ref": ".gluerun-evidence/green.log"
    },
    {
      "kind": "regression-log",
      "ref": ".gluerun-evidence/regression.log"
    },
    {
      "kind": "gate-check",
      "ref": "runs/RUN-20260712T201113Z-58914/gate-check.json"
    },
    {
      "kind": "audit",
      "ref": "runs/RUN-20260712T201113Z-58914/audit.json"
    }
  ],
  "blockers": [],
  "nextAction": "import into control state and reconcile",
  "createdAt": "2026-07-12T20:11:13Z"
}
