{
  "schema": "gluerun.orchestration.state-packet.v0",
  "packetId": "PKT-TASK-0100-20260712T225335Z",
  "runId": "RUN-20260712T225335Z-23899",
  "taskId": "TASK-0100",
  "area": "eval",
  "role": "l2-developer",
  "status": "accepted",
  "baseRef": "f89fdf6622e49c421da60a8ffb1fc173c12e0f38",
  "branch": "agent/eval/TASK-0100-experiment-report-body",
  "headSha": "b8dc6ed37743f63076445d3cdc7a7d94871b4672",
  "workspace": "/Users/alejandro/Desktop/999. PROJECTS/pmgo-orchestration-engine/.worktrees/TASK-0100",
  "ownedFiles": [
    "engine/ctx-experiment-report-body.sh",
    "tests/test-ctx-experiment-report-body.sh"
  ],
  "changedFiles": [
    "engine/ctx-experiment-report-body.sh",
    "tests/test-ctx-experiment-report-body.sh"
  ],
  "commands": [
    {
      "cmd": "bash tests/test-ctx-experiment-report-body.sh",
      "exitCode": 1,
      "logRef": ".gluerun-evidence/red.log"
    },
    {
      "cmd": "bash tests/test-ctx-experiment-report-body.sh",
      "exitCode": 0,
      "logRef": ".gluerun-evidence/green.log"
    },
    {
      "cmd": "bash tests/test-ctx-experiment-report-body.sh && bash tests/test-engine-clean.sh",
      "exitCode": 0,
      "logRef": ".gluerun-evidence/regression.log"
    }
  ],
  "tests": [
    {
      "name": "tests/test-ctx-experiment-report-body.sh",
      "phase": "red",
      "status": "fail",
      "logRef": ".gluerun-evidence/red.log"
    },
    {
      "name": "tests/test-ctx-experiment-report-body.sh",
      "phase": "green",
      "status": "pass",
      "logRef": ".gluerun-evidence/green.log"
    },
    {
      "name": "tests/test-engine-clean.sh",
      "phase": "regression",
      "status": "pass",
      "logRef": ".gluerun-evidence/regression.log"
    }
  ],
  "evidence": [
    {
      "kind": "log",
      "ref": ".gluerun-evidence/red.log"
    },
    {
      "kind": "log",
      "ref": ".gluerun-evidence/green.log"
    },
    {
      "kind": "log",
      "ref": ".gluerun-evidence/regression.log"
    },
    {
      "kind": "gate-check",
      "ref": "runs/RUN-20260712T225335Z-23899/gate-check.json"
    },
    {
      "kind": "audit",
      "ref": "runs/RUN-20260712T225335Z-23899/audit.json"
    }
  ],
  "blockers": [],
  "nextAction": "import into control state and reconcile",
  "createdAt": "2026-07-12T22:53:35Z"
}
