{
  "schema": "gluerun.orchestration.state-packet.v0",
  "packetId": "PKT-TASK-0021-20260711T080020Z",
  "runId": "RUN-20260711T080020Z-20536",
  "taskId": "TASK-0021",
  "area": "plancritic",
  "role": "l2-developer",
  "status": "accepted",
  "baseRef": "46abda663e54b6f96d2cd6adaea45087ac3bfd09",
  "branch": "agent/plancritic/TASK-0021-plan-revise-dispositions",
  "headSha": "379ca122e49ab78251f39306eaf5d30d19103e19",
  "workspace": "/Users/alejandro/Desktop/999. PROJECTS/pmgo-orchestration-engine/.worktrees/TASK-0021",
  "ownedFiles": [
    "engine/ctx-plan-revise-dispositions.sh",
    "tests/test-ctx-plan-revise-dispositions.sh"
  ],
  "changedFiles": [
    "engine/ctx-plan-revise-dispositions.sh",
    "tests/test-ctx-plan-revise-dispositions.sh"
  ],
  "commands": [
    {
      "cmd": "bash tests/test-ctx-plan-revise-dispositions.sh",
      "exitCode": 1,
      "logRef": ".gluerun-evidence/red.log"
    },
    {
      "cmd": "bash tests/test-ctx-plan-revise-dispositions.sh",
      "exitCode": 0,
      "logRef": ".gluerun-evidence/green.log"
    },
    {
      "cmd": "bash tests/run.sh",
      "exitCode": 0,
      "logRef": ".gluerun-evidence/regression.log"
    }
  ],
  "tests": [
    {
      "name": "test-ctx-plan-revise-dispositions.sh",
      "phase": "red",
      "status": "fail",
      "logRef": ".gluerun-evidence/red.log"
    },
    {
      "name": "test-ctx-plan-revise-dispositions.sh",
      "phase": "green",
      "status": "pass",
      "logRef": ".gluerun-evidence/green.log"
    },
    {
      "name": "tests/run.sh (full regression)",
      "phase": "regression",
      "status": "pass",
      "logRef": ".gluerun-evidence/regression.log"
    }
  ],
  "evidence": [
    {
      "kind": "red-log",
      "ref": ".gluerun-evidence/red.log"
    },
    {
      "kind": "green-log",
      "ref": ".gluerun-evidence/green.log"
    },
    {
      "kind": "regression-log",
      "ref": ".gluerun-evidence/regression.log"
    },
    {
      "kind": "gate-check",
      "ref": "runs/RUN-20260711T080020Z-20536/gate-check.json"
    },
    {
      "kind": "audit",
      "ref": "runs/RUN-20260711T080020Z-20536/audit.json"
    }
  ],
  "blockers": [],
  "nextAction": "import into control state and reconcile",
  "createdAt": "2026-07-11T08:00:20Z"
}
