{
  "schema": "gluerun.orchestration.state-packet.v0",
  "packetId": "PKT-TASK-0091-20260712T193900Z",
  "runId": "RUN-20260712T192606Z-76157",
  "taskId": "TASK-0091",
  "area": "eval",
  "role": "l2-developer",
  "status": "accepted",
  "baseRef": "d6bd9be3e658ff9dd860637db7d5716021d0fa32",
  "branch": "agent/eval/TASK-0091-experiment-report-cli",
  "headSha": "7d0265efd7cb301613a8aa430699e924b35989c4",
  "workspace": "/Users/alejandro/Desktop/999. PROJECTS/pmgo-orchestration-engine/.worktrees/TASK-0091",
  "ownedFiles": [
    "cli/gluerun",
    "tests/test-cli-experiment.sh"
  ],
  "changedFiles": [
    "cli/gluerun",
    "tests/test-cli-experiment.sh"
  ],
  "commands": [
    {
      "cmd": "bash tests/test-cli-experiment.sh",
      "exitCode": 1,
      "logRef": ".gluerun-evidence/red.log"
    },
    {
      "cmd": "bash tests/test-cli-experiment.sh",
      "exitCode": 0,
      "logRef": ".gluerun-evidence/green.log"
    },
    {
      "cmd": "bash tests/run.sh",
      "exitCode": 0,
      "logRef": ".gluerun-evidence/regression.log"
    }
  ],
  "tests": [
    {
      "name": "test-cli-experiment.sh",
      "phase": "red",
      "status": "failed",
      "logRef": ".gluerun-evidence/red.log"
    },
    {
      "name": "test-cli-experiment.sh",
      "phase": "green",
      "status": "passed",
      "logRef": ".gluerun-evidence/green.log"
    },
    {
      "name": "tests/run.sh (full-suite gate)",
      "phase": "regression",
      "status": "passed",
      "logRef": ".gluerun-evidence/regression.log"
    }
  ],
  "evidence": [
    {
      "kind": "red-log",
      "ref": ".gluerun-evidence/red.log"
    },
    {
      "kind": "green-log",
      "ref": ".gluerun-evidence/green.log"
    },
    {
      "kind": "regression-log",
      "ref": ".gluerun-evidence/regression.log"
    },
    {
      "kind": "gate-check",
      "ref": "runs/RUN-20260712T192606Z-76157/gate-check.json"
    },
    {
      "kind": "audit",
      "ref": "runs/RUN-20260712T192606Z-76157/audit.json"
    }
  ],
  "blockers": [],
  "nextAction": "import into control state and reconcile",
  "createdAt": "2026-07-12T19:39:00Z"
}
