{
  "schema": "gluerun.orchestration.state-packet.v0",
  "packetId": "PKT-TASK-0097-armaudit-01",
  "runId": "RUN-20260712T215042Z-34601",
  "taskId": "TASK-0097",
  "area": "eval",
  "role": "l2-developer",
  "status": "accepted",
  "baseRef": "810c3ba46a23ea4e05cafd92b2a97d6203824a29",
  "branch": "agent/eval/TASK-0097-experiment-arm-audit",
  "headSha": "872c924c59dde7939e551ee814362206cbe4d7e5",
  "workspace": "/Users/alejandro/Desktop/999. PROJECTS/pmgo-orchestration-engine/.worktrees/TASK-0097",
  "ownedFiles": [
    "engine/ctx-experiment-armaudit.sh",
    "schemas/orchestration/ctx-experiment-armaudit.v0.schema.json",
    "tests/test-ctx-experiment-armaudit.sh"
  ],
  "changedFiles": [
    "engine/ctx-experiment-armaudit.sh",
    "schemas/orchestration/ctx-experiment-armaudit.v0.schema.json",
    "tests/test-ctx-experiment-armaudit.sh"
  ],
  "commands": [
    {
      "cmd": "bash tests/test-ctx-experiment-armaudit.sh",
      "exitCode": 1,
      "logRef": ".gluerun-evidence/red.log"
    },
    {
      "cmd": "bash tests/test-ctx-experiment-armaudit.sh",
      "exitCode": 0,
      "logRef": ".gluerun-evidence/green.log"
    },
    {
      "cmd": "bash tests/test-ctx-experiment-armaudit.sh && bash tests/test-engine-clean.sh",
      "exitCode": 0,
      "logRef": ".gluerun-evidence/regression.log"
    }
  ],
  "tests": [
    {
      "name": "tests/test-ctx-experiment-armaudit.sh",
      "phase": "red",
      "status": "fail",
      "logRef": ".gluerun-evidence/red.log"
    },
    {
      "name": "tests/test-ctx-experiment-armaudit.sh",
      "phase": "green",
      "status": "pass",
      "logRef": ".gluerun-evidence/green.log"
    },
    {
      "name": "tests/test-engine-clean.sh",
      "phase": "green",
      "status": "pass",
      "logRef": ".gluerun-evidence/regression.log"
    }
  ],
  "evidence": [
    {
      "kind": "red-log",
      "ref": ".gluerun-evidence/red.log"
    },
    {
      "kind": "green-log",
      "ref": ".gluerun-evidence/green.log"
    },
    {
      "kind": "regression-log",
      "ref": ".gluerun-evidence/regression.log"
    },
    {
      "kind": "gate-check",
      "ref": "runs/RUN-20260712T215042Z-34601/gate-check.json"
    },
    {
      "kind": "audit",
      "ref": "runs/RUN-20260712T215042Z-34601/audit.json"
    }
  ],
  "blockers": [],
  "nextAction": "import into control state and reconcile",
  "createdAt": "2026-07-12T21:50:42Z"
}
