{
  "schema": "gluerun.orchestration.state-packet.v0",
  "packetId": "PKT-TASK-0014-RUN-20260711T044604Z-95859",
  "runId": "RUN-20260711T044604Z-95859",
  "taskId": "TASK-0014",
  "area": "plancritic",
  "role": "l2-developer",
  "status": "accepted",
  "baseRef": "853a10a10edf0f1fc5e04342295562a8bc9cc90a",
  "branch": "agent/plancritic/TASK-0014-plan-critic-context",
  "headSha": "89d390041992470bc1e1abbf3ac8873bb5db4f5d",
  "workspace": "/Users/alejandro/Desktop/999. PROJECTS/pmgo-orchestration-engine/.worktrees/TASK-0014",
  "ownedFiles": [
    "engine/ctx-plan-critic-context.sh",
    "tests/test-ctx-plan-critic-context.sh"
  ],
  "changedFiles": [
    "engine/ctx-plan-critic-context.sh",
    "tests/test-ctx-plan-critic-context.sh"
  ],
  "commands": [
    {
      "cmd": "bash tests/test-ctx-plan-critic-context.sh",
      "exitCode": 1,
      "logRef": ".gluerun-evidence/red.log"
    },
    {
      "cmd": "bash tests/test-ctx-plan-critic-context.sh",
      "exitCode": 0,
      "logRef": ".gluerun-evidence/green.log"
    },
    {
      "cmd": "bash tests/run.sh",
      "exitCode": 0,
      "logRef": ".gluerun-evidence/regression.log"
    }
  ],
  "tests": [
    {
      "name": "test-ctx-plan-critic-context.sh",
      "phase": "red",
      "status": "fail",
      "logRef": ".gluerun-evidence/red.log"
    },
    {
      "name": "test-ctx-plan-critic-context.sh",
      "phase": "green",
      "status": "pass",
      "logRef": ".gluerun-evidence/green.log"
    },
    {
      "name": "tests/run.sh",
      "phase": "regression",
      "status": "pass",
      "logRef": ".gluerun-evidence/regression.log"
    }
  ],
  "evidence": [
    {
      "kind": "red-log",
      "ref": ".gluerun-evidence/red.log"
    },
    {
      "kind": "green-log",
      "ref": ".gluerun-evidence/green.log"
    },
    {
      "kind": "regression-log",
      "ref": ".gluerun-evidence/regression.log"
    },
    {
      "kind": "gate-check",
      "ref": "runs/RUN-20260711T044604Z-95859/gate-check.json"
    },
    {
      "kind": "audit",
      "ref": "runs/RUN-20260711T044604Z-95859/audit.json"
    }
  ],
  "blockers": [],
  "nextAction": "import into control state and reconcile",
  "createdAt": "2026-07-11T04:46:04Z"
}
