{
  "schema": "gluerun.orchestration.state-packet.v0",
  "packetId": "PKT-TASK-0098-20260713T000000Z",
  "runId": "RUN-20260712T222149Z-27519",
  "taskId": "TASK-0098",
  "area": "eval",
  "role": "l2-developer",
  "status": "accepted",
  "baseRef": "eb212f0833952e1fb7d96ffe47606a47cc2ff03b",
  "branch": "agent/eval/TASK-0098-experiment-render-result",
  "headSha": "008ea56beefb39db04819ff691b0e0bcc481cead",
  "workspace": "/Users/alejandro/Desktop/999. PROJECTS/pmgo-orchestration-engine/.worktrees/TASK-0098",
  "ownedFiles": [
    "engine/ctx-experiment-render-delta.sh",
    "tests/test-ctx-experiment-render-delta.sh"
  ],
  "changedFiles": [
    "engine/ctx-experiment-render-delta.sh",
    "tests/test-ctx-experiment-render-delta.sh"
  ],
  "commands": [
    {
      "cmd": "bash tests/test-ctx-experiment-render-delta.sh",
      "exitCode": 1,
      "logRef": ".gluerun-evidence/red.log"
    },
    {
      "cmd": "bash tests/test-ctx-experiment-render-delta.sh",
      "exitCode": 0,
      "logRef": ".gluerun-evidence/green.log"
    },
    {
      "cmd": "bash tests/test-ctx-experiment-render-delta.sh && bash tests/test-engine-clean.sh",
      "exitCode": 0,
      "logRef": ".gluerun-evidence/regression.log"
    }
  ],
  "tests": [
    {
      "name": "test-ctx-experiment-render-delta.sh",
      "phase": "red",
      "status": "fail",
      "logRef": ".gluerun-evidence/red.log"
    },
    {
      "name": "test-ctx-experiment-render-delta.sh",
      "phase": "green",
      "status": "pass",
      "logRef": ".gluerun-evidence/green.log"
    },
    {
      "name": "test-engine-clean.sh",
      "phase": "regression",
      "status": "pass",
      "logRef": ".gluerun-evidence/regression.log"
    }
  ],
  "evidence": [
    {
      "kind": "red-log",
      "ref": ".gluerun-evidence/red.log"
    },
    {
      "kind": "green-log",
      "ref": ".gluerun-evidence/green.log"
    },
    {
      "kind": "regression-log",
      "ref": ".gluerun-evidence/regression.log"
    },
    {
      "kind": "gate-check",
      "ref": "runs/RUN-20260712T222149Z-27519/gate-check.json"
    },
    {
      "kind": "audit",
      "ref": "runs/RUN-20260712T222149Z-27519/audit.json"
    }
  ],
  "blockers": [],
  "nextAction": "import into control state and reconcile",
  "createdAt": "2026-07-13T00:00:00Z"
}
