{
  "schema": "gluerun.orchestration.state-packet.v0",
  "packetId": "PKT-TASK-0008-RUN-20260711T015656Z-51163",
  "runId": "RUN-20260711T015656Z-51163",
  "taskId": "TASK-0008",
  "area": "session",
  "role": "l2-developer",
  "status": "accepted",
  "baseRef": "94098466975c0f114c42111cad23d31a2fa50bc3",
  "branch": "agent/session/TASK-0008-planner-session-hook",
  "headSha": "7cb32aa83c67a710e26d8ef3d97315ae3a20331a",
  "workspace": "/Users/alejandro/Desktop/999. PROJECTS/pmgo-orchestration-engine/.worktrees/TASK-0008",
  "ownedFiles": [
    "engine/generate-tasks.sh",
    "tests/test-generate-tasks-planner-session-hook.sh"
  ],
  "changedFiles": [
    "engine/generate-tasks.sh",
    "tests/test-generate-tasks-planner-session-hook.sh"
  ],
  "commands": [
    {
      "cmd": "bash tests/test-generate-tasks-planner-session-hook.sh",
      "exitCode": 1,
      "logRef": ".gluerun-evidence/red.log"
    },
    {
      "cmd": "bash tests/test-generate-tasks-planner-session-hook.sh",
      "exitCode": 0,
      "logRef": ".gluerun-evidence/green.log"
    },
    {
      "cmd": "bash tests/run.sh",
      "exitCode": 0,
      "logRef": ".gluerun-evidence/regression.log"
    }
  ],
  "tests": [
    {
      "name": "test-generate-tasks-planner-session-hook.sh",
      "phase": "red",
      "status": "fail",
      "logRef": ".gluerun-evidence/red.log"
    },
    {
      "name": "test-generate-tasks-planner-session-hook.sh",
      "phase": "green",
      "status": "pass",
      "logRef": ".gluerun-evidence/green.log"
    },
    {
      "name": "tests/run.sh (regression suite, 31 passed / 0 failed)",
      "phase": "regression",
      "status": "pass",
      "logRef": ".gluerun-evidence/regression.log"
    }
  ],
  "evidence": [
    {
      "kind": "red-log",
      "ref": ".gluerun-evidence/red.log"
    },
    {
      "kind": "green-log",
      "ref": ".gluerun-evidence/green.log"
    },
    {
      "kind": "regression-log",
      "ref": ".gluerun-evidence/regression.log"
    },
    {
      "kind": "gate-check",
      "ref": "runs/RUN-20260711T015656Z-51163/gate-check.json"
    },
    {
      "kind": "audit",
      "ref": "runs/RUN-20260711T015656Z-51163/audit.json"
    }
  ],
  "blockers": [],
  "nextAction": "import into control state and reconcile",
  "createdAt": "2026-07-11T02:06:00Z"
}
